{"type":"config","name":"Close tokio-port latency gap (target: get rtt_p50 from 36µs back toward main's 21µs)","metricName":"rtt_p50_us","metricUnit":"µs","bestDirection":"lower"}
{"run":1,"commit":"eb663d8","metric":37.7,"metrics":{"rtt_mean_us":44.9,"rtt_p95_us":91.8,"rtt_p99_us":125.1,"thr_mean_mibs":35.2,"thr_p50_mibs":37.9},"status":"keep","description":"Baseline tokio-port (current state). Main branch baseline ~21µs p50; gap = ~15µs.","timestamp":1777293887581,"segment":0,"confidence":null,"iterationTokens":217,"asi":{"hypothesis":"establish baseline","main_branch_baseline_us":21.3,"gap_us":16.4,"hot_path_hops":"stdin_task -> stdout (client) and PTY -> stdout, each routed through mpsc + reader/writer split","first_optimization_idea":"fold server-side reader into direct PTY writes (skip control_tx hop for Input messages)"}}
{"run":2,"commit":"5d20eb9","metric":20.6,"metrics":{"rtt_mean_us":27.6,"rtt_p95_us":71.8,"rtt_p99_us":105.6,"thr_mean_mibs":36.7,"thr_p50_mibs":36.6},"status":"keep","description":"Server reader writes input directly to PTY (skip main task hop). Arc<AsyncFd> + Mutex for write serialization.","timestamp":1777294738411,"segment":0,"confidence":null,"iterationTokens":12375,"asi":{"hypothesis":"skipping main-task hop on inbound (client->PTY) saves one mpsc + one task wakeup per byte","improvement_us":17.1,"next_idea":"skip outbound (PTY->client) hop similarly: main writes directly to OwnedWriteHalf when single live client, or have writer task do nonblocking try_write before yielding","tests_pass":true}}
{"run":3,"commit":"5d20eb9","metric":25.4,"metrics":{"rtt_mean_us":32.1,"rtt_p95_us":71,"rtt_p99_us":97.3,"thr_mean_mibs":21.3,"thr_p50_mibs":21.6},"status":"discard","description":"Replace writer_task with direct writes from main; replay-only task. Backfires.","timestamp":1777294905144,"segment":0,"confidence":3.562500000000002,"iterationTokens":24874,"asi":{"hypothesis":"skip writer_task hop by having main write directly to client write_half via Mutex","lesson":"writer_task lets multiple chunks batch through a single drain loop; main writing directly forces a writable().await per chunk, which is more expensive than the task hop. The mpsc + writer_task design absorbs bursts.","next_action_hint":"go back to writer_task; instead try to reduce the writer_task's overhead — e.g. unbounded mpsc, or have writer use try_write before writable().await, or merge multiple queued packets into one write","rollback_reason":"throughput regressed 42% (37 -> 21 MiB/s); RTT also worse (20.6 -> 25.4)","tests_not_run":"regression too clear"}}
{"run":4,"commit":"5d20eb9","metric":26.7,"metrics":{"rtt_mean_us":33,"rtt_p95_us":73.7,"rtt_p99_us":93.5,"thr_mean_mibs":20.3,"thr_p50_mibs":20.6},"status":"discard","description":"Switch outbound mpsc bounded→unbounded so send() is sync.","timestamp":1777294964106,"segment":0,"confidence":5.6065573770491826,"iterationTokens":5179,"asi":{"hypothesis":"switch outbound mpsc from bounded(64) to unbounded so main's send is sync (not .await)","lesson":"bounded mpsc's send.await provides a critical yield point; without it, main task keeps producing without giving runtime a chance to schedule writer_task. Removes natural cooperative scheduling.","next_action_hint":"leave queue bounded; investigate other paths. Try: instrument writer_task to coalesce multiple packets into one write_all (one syscall instead of N).","rollback_reason":"RTT 20.6->26.7, throughput 37->20 MiB/s. Both worse."}}
{"type":"config","name":"Close tokio-port throughput gap without regressing rtt_p50","metricName":"thr_p50_mibs","metricUnit":"","bestDirection":"higher"}
{"run":5,"commit":"ec8b839","metric":34.9,"metrics":{"rtt_p50_us":20.45,"rtt_mean_us":27.1,"rtt_p95_us":60,"rtt_p99_us":84.7,"thr_mean_mibs":36.1},"status":"keep","description":"Baseline: tokio already +15% ahead of main on throughput, tied on latency. The 'throughput gap' was a measurement artifact.","timestamp":1777296926420,"segment":1,"confidence":null,"iterationTokens":210,"asi":{"finding":"no throughput gap exists under fair measurement conditions; tokio is +15% AHEAD on throughput and tied on latency","hypothesis":"establish throughput baseline; assess whether the gap is real","main_thr_p50_median_6runs":30.5,"main_rtt_p50_median_6runs":20.6,"noise_floor_thr":"thr_p50 sigma ~0.6 MiB/s across 6 runs","previous_session_artifact":"loaded system (load avg 6.7, 62% sys CPU) skewed the comparison to make tokio look behind"}}
{"run":6,"commit":"016d174","metric":29.4,"metrics":{"rtt_mean_us":28.5,"rtt_p50_us":23,"rtt_p95_us":61.8,"rtt_p99_us":90,"thr_mean_mibs":27.5},"status":"discard","description":"Writer batches queued packets via try_recv into one write_all. Backfires.","timestamp":1777297122438,"segment":1,"confidence":null,"iterationTokens":16152,"asi":{"hypothesis":"writer_task batches queued packets via try_recv into one write_all syscall to reduce per-packet syscall overhead","lesson":"batching with cap-64 mpsc means main fills the queue, blocks on send().await, writer drains all 64 in one big write_all (~256KB). The big write blocks waiting for kernel socket buffer space, while many small writes succeed individually. Batching backfires when the batch exceeds socket SNDBUF.","next_idea":"tight PTY drain loop (loop try_io until WouldBlock) — different optimization, doesn't bunch up writes. Or: cap the batch size so it stays under SNDBUF.","regression_thr":"median 29.4 MiB/s vs baseline 34.9 (-15%)","regression_rtt":"median 23 vs baseline 20.45 (slight)","rollback_reason":"throughput regressed 15%; latency also slightly worse"}}
{"run":7,"commit":"016d174","metric":33.75,"metrics":{"rtt_p50_us":20,"rtt_mean_us":27,"rtt_p95_us":65,"rtt_p99_us":90,"thr_mean_mibs":33.5},"status":"discard","description":"Tight PTY drain loop (try_io until WouldBlock) — no measurable improvement on macOS.","timestamp":1777297224563,"segment":1,"confidence":null,"iterationTokens":6882,"asi":{"hypothesis":"tight PTY drain loop (try_io until WouldBlock) cuts wakeups under sustained output","lesson":"macOS PTY scheduler delivers ~1024 bytes per wakeup AND deschedules between reads; consumer almost always finds WouldBlock on the second try_io. Optimization is sound but produces no measurable win on this platform. Could help on Linux (no PTY chunking) but we shouldn't keep changes that don't measurably help here — it adds branching to the hot path for no gain.","next_idea":"Look elsewhere. Possible: reduce per-packet allocations (Packet::clone() in fan-out, Vec for payload). Or: profile to see where time actually goes.","rollback_reason":"thr 33.75 vs baseline 34.9 (-3%, within noise but no improvement); rtt unchanged"}}
